Enter password:
Welcome to the MySQL monitor.  Commands end with ; or \g.
Your MySQL connection id is 11
Server version: 8.0.21 MySQL Community Server - GPL

Copyright (c) 2000, 2020, Oracle and/or its affiliates. All rights reserved.

Oracle is a registered trademark of Oracle Corporation and/or its
affiliates. Other names may be trademarks of their respective
owners.

Type 'help;' or '\h' for help. Type '\c' to clear the current input statement.

mysql> create database Client_master;
Query OK, 1 row affected (0.02 sec)

PART-A

mysql> use Client_master;
Database changed
mysql> CREATE TABLE Client_master(ClientNO VARCHAR(10) PRIMARY KEY, Name VARCHAR(50), Address VARCHAR(100),City VARCHAR(50), State VARCHAR(50), bal_due INT (100));
Query OK, 0 rows affected, 1 warning (0.03 sec)

Q1. mysql> INSERT INTO Client_master values('C001', 'Alice', '123_Street_A', 'Kigali', 'Kigali', 4500.00);
Query OK, 1 row affected (0.01 sec)
mysql> INSERT INTO Client_master values('C002', 'Oda', '456_Street_B', 'Huye', 'Southern', 6000.00);
Query OK, 1 row affected (0.00 sec)
mysql> INSERT INTO Client_master values('C004', 'David', '101_Street_D', 'Rusizi', 'Western', 5200.00);
Query OK, 1 row affected (0.00 sec)
 INSERT INTO Client_master values('C003', 'Jean', '789_Street_C', 'Musanze', 'Northern', 3000.00);
Query OK, 1 row affected (0.00 sec)
mysql> INSERT INTO Client_master values('C005', 'Evelne', '202_Street_E', 'Muhanga', 'Southern', 4000.00);
Query OK, 1 row affected (0.00 sec)
mysql> select *from Client_master;
+----------+--------+--------------+---------+----------+---------+
| ClientNO | Name   | Address      | City    | State    | bal_due |
+----------+--------+--------------+---------+----------+---------+
| C001     | Alice  | 123_Street_A | Kigali  | Kigali   |    4500 |
| C002     | Oda    | 456_Street_B | Huye    | Southern |    6000 |
| C004     | David  | 101_Street_D | Rusizi  | Western  |    5200 |
| C003     | Jean   | 789_Street_C | Musanze | Northern |    3000 |
| C005     | Evelne | 202_Street_E | Muhanga | Southern |    4000 |
+----------+--------+--------------+---------+----------+---------+
5 rows in set (0.00 sec)

Q2.mysql> select name from client_master where bal_due > 5000;
+-------+
| name  |
+-------+
| Oda   |
| David |
+-------+
2 rows in set (0.01 sec)

Q3. mysql> update client_master set bal_due=5100 where clientNO='C123';
Query OK, 0 rows affected (0.02 sec)
Rows matched: 0  Changed: 0  Warnings: 0



Q4. mysql> alter table client_master rename to Client12;
Query OK, 0 rows affected (0.03 sec)


PART-B



A. mysql> CREATE TABLE DEPARTMENTS(DeptID INT PRIMARY KEY, DeptName VARCHAR(50), Location VARCHAR(50), Manager VARCHAR(50),  EstablishedYear INT);
Query OK, 0 rows affected (0.03 sec)

mysql> INSERT INTO DEPARTMENTS values(1, 'Finance', 'Kigali', 'UWASE', 2019);
Query OK, 1 row affected (0.00 sec)

mysql> INSERT INTO DEPARTMENTS values(2, 'DBMS', 'Huye', 'MERCI', 2020);019);
Query OK, 1 row affected (0.00 sec)

ERROR 1064 (42000): You have an error in your SQL syntax; check the manual that corresponds to your MySQL server version for the right syntax to use near '019)' at line 1
mysql> INSERT INTO DEPARTMENTS values(2, 'DBMS', 'Huye', 'MERCI', 2020);
ERROR 1062 (23000): Duplicate entry '2' for key 'departments.PRIMARY'
mysql> INSERT INTO DEPARTMENTS values(3, 'IT', 'Musanze', 'Alice', 2021),
    -> INSERT INTO DEPARTMENTS values(3, 'IT', 'Musanze', 'Alice', 2021);
ERROR 1064 (42000): You have an error in your SQL syntax; check the manual that corresponds to your MySQL server version for the right syntax to use near 'INSERT INTO DEPARTMENTS values(3, 'IT', 'Musanze', 'Alice', 2021)' at line 2
mysql> INSERT INTO DEPARTMENTS values(3, 'IT', 'Musanze', 'Alice', 2021);
Query OK, 1 row affected (0.00 sec)

mysql> INSERT INTO DEPARTMENTS values(4, 'Marketing', 'Rusizi', 'Brown', 2016);
Query OK, 1 row affected (0.00 sec)

mysql> INSERT INTO DEPARTMENTS values(5, 'Trading', 'Muhanga', 'Baraka', 2017);
Query OK, 1 row affected (0.00 sec)

mysql> CREATE TABLE EMPLOYEES(EmpID INT PRIMARY KEY, EmpName VARCHAR(50), Position VARCHAR(50), DeptID INT, Salary INT(100), FOREIGN KEY (DeptID) REFERENCES DEPARTMENTS(DeptID));
Query OK, 0 rows affected, 1 warning (0.01 sec)

mysql> NSERT INTO EMPLOYEES VALUES(101, 'John', 'Analyst', 1, 55000);
ERROR 1064 (42000): You have an error in your SQL syntax; check the manual that corresponds to your MySQL server version for the right syntax to use near 'NSERT INTO EMPLOYEES VALUES(101, 'John', 'Analyst', 1, 55000)' at line 1
mysql> INSERT INTO EMPLOYEES VALUES(101, 'John', 'Analyst', 1, 55000);
Query OK, 1 row affected (0.00 sec)

mysql> INSERT INTO EMPLOYEES VALUES(102, 'Queen', 'Accountant', 2, 45000);
Query OK, 1 row affected (0.00 sec)

mysql> INSERT INTO EMPLOYEES VALUES(103, 'Prince', 'Developer', 3, 60000);
Query OK, 1 row affected (0.00 sec)

mysql> INSERT INTO EMPLOYEES VALUES(104, 'Diana', 'Manager', 4, 75000);
Query OK, 1 row affected (0.00 sec)

mysql> INSERT INTO EMPLOYEES VALUES(105, 'Chris', 'Supervisor', 5, 50000);
Query OK, 1 row affected (0.00 sec)

mysql> select *from departments;
+--------+-----------+----------+---------+-----------------+
| DeptID | DeptName  | Location | Manager | EstablishedYear |
+--------+-----------+----------+---------+-----------------+
|      1 | Finance   | Kigali   | UWASE   |            2019 |
|      2 | DBMS      | Huye     | MERCI   |            2020 |
|      3 | IT        | Musanze  | Alice   |            2021 |
|      4 | Marketing | Rusizi   | Brown   |            2016 |
|      5 | Trading   | Muhanga  | Baraka  |            2017 |
+--------+-----------+----------+---------+-----------------+
5 rows in set (0.00 sec)

mysql> select *from employees;
+-------+---------+------------+--------+--------+
| EmpID | EmpName | Position   | DeptID | Salary |
+-------+---------+------------+--------+--------+
|   101 | John    | Analyst    |      1 |  55000 |
|   102 | Queen   | Accountant |      2 |  45000 |
|   103 | Prince  | Developer  |      3 |  60000 |
|   104 | Diana   | Manager    |      4 |  75000 |
|   105 | Chris   | Supervisor |      5 |  50000 |
+-------+---------+------------+--------+--------+
5 rows in set (0.00 sec)

B. mysql> desc employees;
+----------+-------------+------+-----+---------+-------+
| Field    | Type        | Null | Key | Default | Extra |
+----------+-------------+------+-----+---------+-------+
| EmpID    | int         | NO   | PRI | NULL    |       |
| EmpName  | varchar(50) | YES  |     | NULL    |       |
| Position | varchar(50) | YES  |     | NULL    |       |
| DeptID   | int         | YES  | MUL | NULL    |       |
| Salary   | int         | YES  |     | NULL    |       |
+----------+-------------+------+-----+---------+-------+
5 rows in set (0.04 sec)

C.mysql> SELECT EMPLOYEES.EmpName AS EmployeeName, DEPARTMENTS.DeptName AS DepartmentName FROM EMPLOYEES LEFT OUTER JOIN DEPARTMENTS ON  EMPLOYEES.DeptID = DEPARTMENTS.DeptID;
+--------------+----------------+
| EmployeeName | DepartmentName |
+--------------+----------------+
| John         | Finance        |
| Queen        | DBMS           |
| Prince       | IT             |
| Diana        | Marketing      |
| Chris        | Trading        |
+--------------+----------------+
5 rows in set (0.02 sec)


D. mysql> SELECT EMPLOYEES.EmpName AS EmployeeName,  DEPARTMENTS.DeptName AS DepartmentName FROM EMPLOYEES LEFT OUTER JOIN DEPARTMENTS ON EMPLOYEES.DeptID = DEPARTMENTS.DeptID;
+--------------+----------------+
| EmployeeName | DepartmentName |
+--------------+----------------+
| John         | Finance        |
| Queen        | DBMS           |
| Prince       | IT             |
| Diana        | Marketing      |
| Chris        | Trading        |
+--------------+----------------+
5 rows in set (0.00 sec)

E. mysql> SELECT EmpID, EmpName, Position, DeptID, Salary FROM EMPLOYEES WHERE Salary > (SELECT AVG(Salary) FROM EMPLOYEES);
+-------+---------+-----------+--------+--------+
| EmpID | EmpName | Position  | DeptID | Salary |
+-------+---------+-----------+--------+--------+
|   103 | Prince  | Developer |      3 |  60000 |
|   104 | Diana   | Manager   |      4 |  75000 |
+-------+---------+-----------+--------+--------+
2 rows in set (0.02 sec)




Q7. mysql> create database SCHOOL1;
Query OK, 1 row affected (0.01 sec)

mysql> use school 1;
Database changed

mysql> create table students( studentid varchar(5) primary key, fullname varchar(25), gender varchar(6),age int(2), department varchar(30) not null);
Query OK, 0 rows affected, 1 warning (0.01 sec)

mysql> insert into students values('S01','MUCYO Jane', 'FEMALE', 21,'BIT'),('S02','EVARISTE', 'MALE', 22,'Acc'),('S03','DINAH', 'FEMALE', 19, 'BIT'),('S04','ALoys', 'MALE', 22, 'ACCOUNTINg'),('S05','Cloude','MALE', 24, 'HR')
    
Query OK, 5 rows affected (0.00 sec)
Records: 5  Duplicates: 0  Warnings: 0




1. mysql> select * from students;
+-----------+-----------------+--------+------+------------+
| studentid | fullname        | gender | age  | department |
+-----------+-----------------+--------+------+------------+
| S01       | MUCYO Jane      | FEMALE |   21 | BIT        |
| S03       | EVARISTE        | MALE   |   22 | ACC        |
| S02       | DINAH           | FEMALE |   19 | BIT        |
| S04       | ALOYS           | MALE   |   22 | ACCOUNTINg |
| S05       | CLOUDE          | MALE   |   24 | HR         |
+-----------+-----------------+--------+------+------------+
5 rows in set (0.00 sec)




2. mysql> select * from students where gender='female';
+-----------+----------------+--------+------+------------+
| studentid | fullname       | gender | age  | department |
+-----------+----------------+--------+------+------------+
| S01       | MUCYO JANE     | FEMALE |   21 | BIT        |
| S02       | DINAH          | FEMALE |   19 | BIT        |
+-----------+----------------+--------+------+------------+
2 rows in set (0.00 sec)



3. mysql> select * from students where gender='male';
+-----------+-----------------+--------+------+------------+
| studentid | fullname        | gender | age  | department |
+-----------+-----------------+--------+------+------------+
| S03       | EVARISTE        | MALE   |   22 | ACC        |
| S04       | ALOYS           | MALE   |   22 | ACCOUNTINg |
| S05       | CLOUDE          | MALE   |   24 | HR         |
+-----------+-----------------+--------+------+------------+
3 rows in set (0.00 sec)



4. mysql> insert into students values('S06','UMUCYO ALICE', 'FEMALE', 30,'DSL');
Query OK, 1 row affected (0.00 sec)

mysql> select * from students where gender='male';
+-----------+-----------------+--------+------+------------+
| studentid | fullname        | gender | age  | department |
+-----------+-----------------+--------+------+------------+
| S03       | EVARISTE        | MALE   |   22 | ACC        |
| S04       | ALOYS           | MALE   |   22 | ACCOUNTINg |
| S05       | CLOUDE          | MALE   |   24 | HR         |
+-----------+-----------------+--------+------+------------+
3 rows in set (0.00 sec)

mysql> select * from students where gender='female';
+-----------+----------------------+--------+------+------------+
| studentid | fullname             | gender | age  | department |
+-----------+----------------------+--------+------+------------+
| S01       | MUCYO JANE           | FEMALE |   22 | BIT        |
| S02       | DINAH                | FEMALE |   19 | BIT        |
| S06       | UMUCYO ALICE         | FEMALE |   30 | DSL        |
+-----------+----------------------+--------+------+------------+
3 rows in set (0.00 sec)



5. mysql> delete from students where age<20;
Query OK, 1 row affected (0.00 sec)

mysql> select * from students;
+-----------+----------------------+--------+------+------------+
| studentid | fullname             | gender | age  | department |
+-----------+----------------------+--------+------+------------+
| S01       | MUCYO JANE           | FEMALE |   22 | BIT        |
| S03       | EVARISTE             | MALE   |   21 | ACC        |
| S04       | ALOYS                | MALE   |   22 | ACCOUNTINg |
| S05       | CLOUDE               | MALE   |   24 | HR         |
| S06       | UMUCYO ALICE         | FEMALE |   30 | DSL        |
+-----------+----------------------+--------+------+------------+
5 rows in set (0.00 sec)




PART-C


 
Q9. A.  mysql> create table EMPLOYEE(Employee_Id int primary key, First_Name varchar(60), Last_Name varchar(50), Email varchar(100), Phone_Number varchar(15), Hire_Date date, job_Id varchar(12), Salary int(7), Commission_Pct int(500), Manager_Id varchar(13), Department_Id varchar(15));
Query OK, 0 rows affected, 1 warning (0.03 sec)

mysql> insert into EMPLOYEE values(101, 'John', 'obe', 'johnii@gmail.com', '555-1234', '2020-01-15', 'obed', 5000, 0.10, 100, 60);
Query OK, 1 row affected, 1 warning (0.00 sec)

mysql> insert into EMPLOYEE values(102, 'Johnn', 'obee', 'johnn@gmail.com', '565-1235', '2021-02-16', 'obeg', 5001, 1.09, 10, 61);
Query OK, 1 row affected, 1 warning (0.00 sec)

mysql> insert into EMPLOYEE values(103, 'elyse', 'obeer', 'nicodeme@gmail.com', '505-1230', '2011-07-18', 'ober', 5002, 1.00, 110, 62);
Query OK, 1 row affected (0.00 sec)

mysql> insert into EMPLOYEE values(104, 'muhoza', 'moise', 'nicodee@gmail.com', '805-1200', '2012-04-19', 'revee', 5077, 1.90, 210, 82);
Query OK, 1 row affected, 1 warning (0.00 sec)

mysql> insert into EMPLOYEE values(105, 'edison', 'helali', 'tuyubahe@gmail.com', '875-1210', '2025-09-14', 'renne', 5037, 1.50, 20, 81);
Query OK, 1 row affected, 1 warning (0.00 sec)

mysql> select * from EMPLOYEE;
+-------------+------------+-----------+--------------------+--------------+------------+--------+--------+----------------+------------+---------------+
| Employee_Id | First_Name | Last_Name | Email              | Phone_Number | Hire_Date  | job_Id | Salary | Commission_Pct | Manager_Id | Department_Id |
+-------------+------------+-----------+--------------------+--------------+------------+--------+--------+----------------+------------+---------------+
|         101 | John       | obe       | johnii@gmail.com   | 555-1234     | 2020-01-15 | obed   |   5000 |              0 | 100        | 60            |
|         102 | Johnn      | obee      | johnn@gmail.com    | 565-1235     | 2020-02-16 | obeg   |   5001 |              1 | 10         | 61            |
|         103 | elyse      | obeer     | nicodeme@gmail.com | 505-1230     | 2010-07-18 | ober   |   5002 |              1 | 110        | 62            |
|         104 | muhoza     | moise     | nicodee@gmail.com  | 805-1200     | 2010-04-19 | revee  |   5077 |              2 | 210        | 82            |
|         105 | edison     | helali    | tuyubahe@gmail.com | 875-1210     | 2020-09-14 | renne  |   5037 |              2 | 20         | 81            |
+-------------+------------+-----------+--------------------+--------------+------------+--------+--------+----------------+------------+---------------+
5 rows in set (0.00 sec)

mysql> SELECT Employee_Id, First_Name, Last_Name, Salary FROM EMPLOYEES;
ERROR 1054 (42S22): Unknown column 'Employee_Id' in 'field list'
mysql> SELECT Employee_Id, First_Name, Last_Name, Salary FROM EMPLOYEE;
+-------------+------------+-----------+--------+
| Employee_Id | First_Name | Last_Name | Salary |
+-------------+------------+-----------+--------+
|         101 | John       | obe       |   5000 |
|         102 | Johnn      | obee      |   5001 |
|         103 | elyse      | obeer     |   5002 |
|         104 | muhoza     | moise     |   5077 |
|         105 | edison     | helali    |   5037 |
+-------------+------------+-----------+--------+
5 rows in set (0.00 sec)

B. mysql> SELECT * FROM EMPLOYEE WHERE Manager_Id = 100;
+-------------+------------+-----------+------------------+--------------+------------+--------+--------+----------------+------------+---------------+
| Employee_Id | First_Name | Last_Name | Email            | Phone_Number | Hire_Date  | job_Id | Salary | Commission_Pct | Manager_Id | Department_Id |
+-------------+------------+-----------+------------------+--------------+------------+--------+--------+----------------+------------+---------------+
|         101 | John       | obe       | johnii@gmail.com | 555-1234     | 2020-01-15 | obed   |   5000 |              0 | 100        | 60            |
+-------------+------------+-----------+------------------+--------------+------------+--------+--------+----------------+------------+---------------+
1 row in set (0.01 sec)

C. mysql> SELECT First_Name, Last_Name FROM EMPLOYEE WHERE Salary >= 4800;
+------------+-----------+
| First_Name | Last_Name |
+------------+-----------+
| John       | obe       |
| Johnn      | obee      |
| elyse      | obeer     |
| muhoza     | moise     |
| edison     | helali    |
+------------+-----------+
5 rows in set (0.00 sec)

D. mysql> SELECT First_Name, Last_Name FROM EMPLOYEE WHERE Last_Name = 'AUSTIN';
Empty set (0.00 sec)

E. mysql> SELECT First_Name, Last_Name FROM EMPLOYEE WHERE Department_Id IN (60, 70, 80);
+------------+-----------+
| First_Name | Last_Name |
+------------+-----------+
| John       | obe       |
+------------+-----------+
1 row in set (0.02 sec)

mysql>




Q10. mysql> create database SALES;
Query OK, 1 row affected (0.00 sec)

mysql> use sales;
Database changed
mysql> CREATE TABLE Sales (Sales_No INT PRIMARY KEY, Salesname VARCHAR(50), Branch VARCHAR(50), Salesamount INT (100), DOB DATE);
Query OK, 0 rows affected (0.01 sec)

mysql> INSERT INTO Sales (Sales_No, Salesname, Branch, Salesamount, DOB) VALUES(1, 'Mucyo Nshimiyimana', 'Kigali Branch', 1000, '1990-12-15'), (2, 'Ganza Rurangirwa', 'Huye Branch', 1500, '1985-05-20'),(3, 'David Lee', 'Musanze Branch', 800, '1978-08-10'),(4, 'Sarah Jones', 'Rubavu Branch', 2000, '1992-11-01'),(5, 'Michael Brown', 'Kigali Branch', 1200, '1988-12-25');
Query OK, 5 rows affected (0.00 sec)
Records: 5  Duplicates: 0  Warnings: 0

mysql> select * from sales;
+----------+--------------------+----------------+-------------+------------+
| Sales_No | Salesname          | Branch         | Salesamount | DOB        |
+----------+--------------------+----------------+-------------+------------+
|        1 | Mucyo Nshimiyimana | Kigali Branch  |     1000.00 | 1990-12-15 |
|        2 | Ganza Rurangirwa   | Huye Branch    |     1500.00 | 1985-05-20 |
|        3 | David Lee          | Musanze Branch |      800.00 | 1978-08-10 |
|        4 | Sarah Jones        | Rubavu Branch  |     2000.00 | 1992-11-01 |
|        5 | Michael Brown      | Kigali Branch  |     1200.00 | 1988-12-25 |
+----------+--------------------+----------------+-------------+------------+
5 rows in set (0.00 sec)

mysql> SELECT Branch, SUM(Salesamount) AS Total_Sales FROM Sales GROUP BY Branch;
+----------------+-------------+
| Branch         | Total_Sales |
+----------------+-------------+
| Kigali Branch  |     2200.00 |
| Huye Branch    |     1500.00 |
| Musanze Branch |      800.00 |
| Rubavu Branch  |     2000.00 |
+----------------+-------------+
4 rows in set (0.00 sec)

mysql> SELECT Branch, AVG(Salesamount) AS Avg_Sales FROM Sales GROUP BY Branch;
+----------------+-------------+
| Branch         | Avg_Sales   |
+----------------+-------------+
| Kigali Branch  | 1100.000000 |
| Huye Branch    | 1500.000000 |
| Musanze Branch |  800.000000 |
| Rubavu Branch  | 2000.000000 |
+----------------+-------------+
4 rows in set (0.00 sec)

mysql> SELECT Salesname, TO_CHAR(DOB, 'DD-Mon-YY') AS DOB_Formatted FROM Sales WHERE EXTRACT(MONTH FROM DOB) = 12;
ERROR 1305 (42000): FUNCTION sales.TO_CHAR does not exist
mysql> SELECT Salesname, TO_CHAR(DOB, 'DD-Mon-YY') AS DOB_Formatted FROM Sales WHERE EXTRACT(MONTH FROM DOB) = 12;
ERROR 1305 (42000): FUNCTION sales.TO_CHAR does not exist

mysql> SELECT Salesname, TO_CHAR(DOB, 'Mon') AS DOB_Month FROM Sales ORDER BY DOB_Month;
ERROR 1305 (42000): FUNCTION sales.TO_CHAR does not exist

mysql> SELECT Salesname, DATE_FORMAT(DOB, '%d-%b-%y') AS DOB_Formatted FROM Sales WHERE MONTH(DOB) = 12;
+--------------------+---------------+
| Salesname          | DOB_Formatted |
+--------------------+---------------+
| Mucyo Nshimiyimana | 15-Dec-90     |
| Michael Brown      | 25-Dec-88     |
+--------------------+---------------+
2 rows in set (0.00 sec)

mysql> SELECT Salesname, DATE_FORMAT(DOB, '%b') AS DOB_Month FROM Sales ORDER BY DOB_Month;
+--------------------+-----------+
| Salesname          | DOB_Month |
+--------------------+-----------+
| David Lee          | Aug       |
| Mucyo Nshimiyimana | Dec       |
| Michael Brown      | Dec       |
| Ganza Rurangirwa   | May       |
| Sarah Jones        | Nov       |
+--------------------+-----------+
5 rows in set (0.00 sec)

mysql>
